{
  "task_name": "example-task",
  "task_path": "doc/01-infrastructure-setup/example-task",
  "wave": 0,
  "execution_mode": "serial",
  "depends_on": [],
  "blocks": [],
  "created_at": "2026-04-23",
  "metadata": {
    "taskType": "spec_created",
    "docs_only": true
  },
  "phases": [
    {
      "phase": 1,
      "name": "要件定義",
      "file": "phase-01.md",
      "status": "pending",
      "outputs": [
        "outputs/phase-01/main.md"
      ],
      "depends_on_phases": [],
      "user_approval_required": false
    },
    {
      "phase": 2,
      "name": "設計",
      "file": "phase-02.md",
      "status": "pending",
      "outputs": [
        "outputs/phase-02/main.md"
      ],
      "depends_on_phases": [
        1
      ],
      "user_approval_required": false
    },
    {
      "phase": 3,
      "name": "設計レビュー",
      "file": "phase-03.md",
      "status": "pending",
      "outputs": [
        "outputs/phase-03/main.md"
      ],
      "depends_on_phases": [
        2
      ],
      "user_approval_required": false
    },
    {
      "phase": 4,
      "name": "事前検証手順",
      "file": "phase-04.md",
      "status": "pending",
      "outputs": [
        "outputs/phase-04/main.md"
      ],
      "depends_on_phases": [
        3
      ],
      "user_approval_required": false
    },
    {
      "phase": 5,
      "name": "セットアップ実行",
      "file": "phase-05.md",
      "status": "pending",
      "outputs": [
        "outputs/phase-05/main.md"
      ],
      "depends_on_phases": [
        4
      ],
      "user_approval_required": false
    },
    {
      "phase": 6,
      "name": "異常系検証",
      "file": "phase-06.md",
      "status": "pending",
      "outputs": [
        "outputs/phase-06/main.md"
      ],
      "depends_on_phases": [
        5
      ],
      "user_approval_required": false
    },
    {
      "phase": 7,
      "name": "検証項目網羅性",
      "file": "phase-07.md",
      "status": "pending",
      "outputs": [
        "outputs/phase-07/main.md"
      ],
      "depends_on_phases": [
        6
      ],
      "user_approval_required": false
    },
    {
      "phase": 8,
      "name": "設定 DRY 化",
      "file": "phase-08.md",
      "status": "pending",
      "outputs": [
        "outputs/phase-08/main.md"
      ],
      "depends_on_phases": [
        7
      ],
      "user_approval_required": false
    },
    {
      "phase": 9,
      "name": "品質保証",
      "file": "phase-09.md",
      "status": "pending",
      "outputs": [
        "outputs/phase-09/main.md"
      ],
      "depends_on_phases": [
        8
      ],
      "user_approval_required": false
    },
    {
      "phase": 10,
      "name": "最終レビュー",
      "file": "phase-10.md",
      "status": "pending",
      "outputs": [
        "outputs/phase-10/main.md"
      ],
      "depends_on_phases": [
        9
      ],
      "user_approval_required": false
    },
    {
      "phase": 11,
      "name": "手動 smoke test",
      "file": "phase-11.md",
      "status": "pending",
      "outputs": [
        "outputs/phase-11/main.md"
      ],
      "depends_on_phases": [
        10
      ],
      "user_approval_required": false
    },
    {
      "phase": 12,
      "name": "ドキュメント更新",
      "file": "phase-12.md",
      "status": "pending",
      "outputs": [
        "outputs/phase-12/main.md"
      ],
      "depends_on_phases": [
        11
      ],
      "user_approval_required": false
    },
    {
      "phase": 13,
      "name": "PR作成",
      "file": "phase-13.md",
      "status": "pending",
      "outputs": [
        "outputs/phase-13/main.md"
      ],
      "depends_on_phases": [
        12
      ],
      "user_approval_required": true
    }
  ],
  "external_services": [],
  "secrets_introduced": [],
  "infra_artifacts": [],
  "doc_references": []
}
